{
  "$schema": "https://json-schema.org/draft/2020-12/schema",
  "$id": "https://github.com/shimpeiws/gatefold/schema/claim-result.v5.json",
  "title": "Gatefold run-comparison result",
  "description": "Machine-readable claim collection emitted by gatefold compare-runs --format json. Version 5 describes a two-run-directory A -> B comparison: evidence references name which document of which run they resolve against (trace, artifact manifest, or verified patch bytes), and per-run metadata lives in the inputs map.",
  "type": "object",
  "additionalProperties": false,
  "required": ["schemaVersion", "source", "inputs", "claims"],
  "properties": {
    "schemaVersion": {
      "type": "integer",
      "const": 5,
      "description": "Version of this result schema. Additive changes keep the version; structural changes bump it."
    },
    "source": {
      "type": "object",
      "additionalProperties": false,
      "required": ["command"],
      "description": "Identifies this result as a two-run-directory comparison.",
      "properties": {
        "command": {
          "type": "string",
          "const": "compare-runs"
        }
      }
    },
    "inputs": {
      "type": "object",
      "additionalProperties": false,
      "required": ["beforeRun", "afterRun"],
      "description": "Descriptors of the two validated yuurei run directories, keyed by their role in the comparison.",
      "properties": {
        "beforeRun": { "$ref": "#/$defs/runInput" },
        "afterRun": { "$ref": "#/$defs/runInput" }
      }
    },
    "claims": {
      "type": "array",
      "items": { "$ref": "#/$defs/claim" }
    }
  },
  "$defs": {
    "traceInput": {
      "type": "object",
      "additionalProperties": false,
      "required": [
        "label",
        "document",
        "schemaVersion",
        "runId",
        "startedAt",
        "finishedAt",
        "runtimeId",
        "runtimeVersion",
        "modelRequested",
        "modelResolved",
        "profileName",
        "profileDigest",
        "taskSource",
        "taskDigest",
        "isolationStrategy",
        "isolationVerified"
      ],
      "properties": {
        "label": {
          "type": "string",
          "minLength": 1,
          "description": "The input argument as supplied, or '<stdin>'."
        },
        "document": { "type": "string", "const": "yuurei-trace" },
        "schemaVersion": {
          "type": "string",
          "description": "The trace's schema_version compatibility token, compared for equality (currently '0.3')."
        },
        "runId": { "type": "string", "minLength": 1 },
        "yuureiVersion": {
          "type": "string",
          "description": "yuurei_version of the trace; absent when the trace does not carry it."
        },
        "startedAt": { "type": "string" },
        "finishedAt": { "type": "string" },
        "runtimeId": { "type": "string", "minLength": 1 },
        "runtimeVersion": {
          "type": ["string", "null"],
          "description": "runtime.version of the trace; null is preserved as null."
        },
        "modelRequested": { "type": "string", "minLength": 1 },
        "modelResolved": {
          "type": ["string", "null"],
          "description": "model.resolved of the trace; null means the effective model was not observed."
        },
        "modelResolvedReason": {
          "type": "string",
          "enum": ["observed", "unobserved", "parse_failed"],
          "description": "model.resolved_reason of the trace; absent when the trace does not carry it."
        },
        "profileName": { "type": "string" },
        "profileDigest": { "type": "string", "minLength": 1 },
        "taskSource": { "type": "string" },
        "taskDigest": { "type": "string", "minLength": 1 },
        "isolationStrategy": { "type": "string", "minLength": 1 },
        "isolationVerified": { "type": "boolean" },
        "requestedCellDigest": {
          "type": "string",
          "description": "requested_cell.digest of the trace; absent when the trace does not carry it."
        },
        "requestedCellInputsVersion": {
          "type": "integer",
          "description": "requested_cell.inputs_version of the trace; absent when the trace does not carry it."
        },
        "executionOptions": {
          "type": "object",
          "description": "The trace's execution_options value recorded verbatim; absent when the trace does not carry it."
        },
        "definition": {
          "type": "object",
          "description": "The trace's definition value recorded verbatim ({ run: string | null, cli_overrides: string[] }); absent when the trace does not carry it."
        }
      }
    },
    "artifactEntry": {
      "type": "object",
      "additionalProperties": false,
      "required": ["path", "kind", "digest", "state"],
      "description": "One artifact manifest entry preserved verbatim plus Gatefold's verification outcome.",
      "properties": {
        "path": {
          "type": "string",
          "minLength": 1,
          "description": "The manifest-recorded path, relative to the run directory. Treated as data, never as an access instruction."
        },
        "kind": { "type": "string" },
        "digest": {
          "type": "string",
          "description": "The manifest-recorded digest of the stored bytes (sha256:<hex> when verifiable)."
        },
        "truncated": {
          "type": "boolean",
          "const": true,
          "description": "Present and true only when the manifest marks the stored bytes as cut at yuurei's size cap. The digest covers the stored (cut) bytes."
        },
        "bytes": {
          "type": "integer",
          "minimum": 0,
          "description": "Stored byte count when the file was examined; absent when the artifact was not read."
        },
        "state": {
          "type": "string",
          "enum": [
            "verified",
            "verified-truncated",
            "digest-mismatch",
            "missing",
            "unverified"
          ],
          "description": "Verification outcome: the stored bytes hash to the recorded digest (verified, or verified-truncated when also marked truncated), they do not (digest-mismatch), no readable file exists at the path (missing), or the bytes were not read or not verifiable in this milestone (unverified)."
        }
      }
    },
    "runInput": {
      "type": "object",
      "additionalProperties": false,
      "required": ["label", "document", "trace", "patchState", "artifacts"],
      "description": "Descriptor of one loaded yuurei run directory: the supplied label, the trace descriptor, the patch summary state, and the manifest facts.",
      "properties": {
        "label": {
          "type": "string",
          "minLength": 1,
          "description": "The run directory argument as supplied."
        },
        "document": { "type": "string", "const": "yuurei-run" },
        "trace": { "$ref": "#/$defs/traceInput" },
        "patchState": {
          "type": "string",
          "enum": [
            "verified",
            "verified-truncated",
            "digest-mismatch",
            "missing",
            "unverified",
            "malformed",
            "not-recorded"
          ],
          "description": "The state of the run's patch.diff: the manifest entry's state when listed, 'malformed' when verified bytes violate the patch grammar, or 'not-recorded' when the manifest lists no patch entry."
        },
        "artifacts": {
          "type": "array",
          "items": { "$ref": "#/$defs/artifactEntry" }
        }
      }
    },
    "claim": {
      "type": "object",
      "additionalProperties": false,
      "required": ["claim", "ruleId", "evidence", "provenance", "confidence"],
      "properties": {
        "claim": {
          "type": "string",
          "minLength": 1,
          "description": "A single descriptive statement about the comparison. Never a judgement of quality."
        },
        "ruleId": {
          "type": "string",
          "minLength": 1,
          "description": "Stable identifier of the rule that produced this claim."
        },
        "evidence": {
          "type": "array",
          "minItems": 1,
          "items": { "$ref": "#/$defs/evidenceReference" },
          "description": "References into the two runs' documents that support the claim. A claim without evidence is invalid."
        },
        "provenance": { "$ref": "#/$defs/provenance" },
        "confidence": {
          "type": "number",
          "minimum": 0,
          "maximum": 1,
          "description": "Certainty that the evidence supports the claim. 1 = fully supported. Not a harness quality score."
        }
      }
    },
    "evidenceReference": {
      "type": "object",
      "additionalProperties": false,
      "required": ["source", "pointer"],
      "properties": {
        "source": {
          "type": "string",
          "enum": [
            "beforeTrace",
            "afterTrace",
            "beforeManifest",
            "afterManifest",
            "beforePatch",
            "afterPatch"
          ],
          "description": "Which document of which run the reference resolves against: the run's trace.json, its artifacts.json, or its verified patch.diff bytes."
        },
        "pointer": {
          "type": "string",
          "pattern": "^$|^(?:/(?:[^/~]|~0|~1)*)*$",
          "description": "JSON Pointer (RFC 6901) into the document named by source. For the *Patch sources it is the manifest pointer of the run's patch.diff entry, binding the citation to the manifest record. The empty string references the whole document."
        },
        "digest": {
          "type": "string",
          "pattern": "^sha256:[0-9a-f]{64}$",
          "description": "Patch evidence only: the manifest-recorded digest of the stored patch bytes the range locates into."
        },
        "path": {
          "type": "string",
          "minLength": 1,
          "description": "Patch evidence only: the generated-file path whose block the range locates inside the stored patch bytes."
        },
        "lines": {
          "$ref": "#/$defs/range",
          "description": "Patch evidence only: an inclusive 1-based line range inside the stored patch bytes."
        },
        "bytes": {
          "$ref": "#/$defs/range",
          "description": "Patch evidence only: a half-open 0-based byte range inside the stored patch bytes."
        },
        "elementId": {
          "type": "string",
          "minLength": 1,
          "description": "Identifier of the referenced element, verbatim from the input document. Unused by trace and run claims."
        },
        "note": {
          "type": "string",
          "description": "Optional human-readable clarification of what the reference shows, for example that a patch records no block for a path."
        }
      }
    },
    "range": {
      "type": "object",
      "additionalProperties": false,
      "required": ["start", "end"],
      "properties": {
        "start": { "type": "integer", "minimum": 0 },
        "end": { "type": "integer", "minimum": 0 }
      },
      "description": "An inclusive 1-based line range or a half-open 0-based byte range into stored patch bytes."
    },
    "provenance": {
      "type": "object",
      "additionalProperties": false,
      "required": ["transform"],
      "description": "Per-run metadata (directory labels, trace descriptors, manifest facts) lives in the top-level inputs map because a comparison claim can cite both runs.",
      "properties": {
        "transform": {
          "type": "array",
          "items": { "type": "string" },
          "description": "Names of the transformations applied between the raw inputs and this claim, in application order. Empty when the claim reads the inputs directly."
        }
      }
    }
  }
}
